university_name,unit_type,unit_name,parent_unit,campus_or_city,focus_areas,official_url,notes,last_verified
University of Vaasa,School,"School of Accounting and Finance",,Vaasa,"Accounting; Finance",https://www.uwasa.fi/en/about/organization,Official organization page.,2026-03-14
University of Vaasa,School,"School of Management",,Vaasa,"Management; Public management",https://www.uwasa.fi/en/about/organization,Official organization page.,2026-03-14
University of Vaasa,School,"School of Marketing and Communication",,Vaasa,"Marketing; Communication",https://www.uwasa.fi/en/about/organization,Official organization page.,2026-03-14
University of Vaasa,School,"School of Technology and Innovations",,Vaasa,"Technology; Information systems; Industrial management",https://www.uwasa.fi/en/about/organization,Official organization page.,2026-03-14
Hanken School of Economics,Department,"Department of Accounting and Commercial Law",,Helsinki,"Accounting; Commercial law",https://www.hanken.fi/en/departments-and-centres,Official departments and centres page.,2026-03-14
Hanken School of Economics,Department,"Department of Economics",,Helsinki,"Economics; Statistics",https://www.hanken.fi/en/departments-and-centres,Official departments and centres page.,2026-03-14
Hanken School of Economics,Department,"Department of Management and Organisation",,Helsinki,"Management; Organisation; Information systems science",https://www.hanken.fi/en/departments-and-centres,Official departments and centres page.,2026-03-14
Hanken School of Economics,Department,"Department of Marketing",,Helsinki,"Marketing; Supply chain management; Social responsibility",https://www.hanken.fi/en/departments-and-centres,Official departments and centres page.,2026-03-14
Abo Akademi University,Faculty,"Faculty of Arts, Psychology and Theology",,Turku,"Arts; Psychology; Theology",https://www.abo.fi/en/news/faculties-at-abo-akademi-university-from-january-1-2025/,Official university announcement of faculty structure.,2026-03-14
Abo Akademi University,Faculty,"Faculty of Social Sciences, Business and Economics, and Law",,Turku,"Social sciences; Business; Economics; Law",https://www.abo.fi/en/news/faculties-at-abo-akademi-university-from-january-1-2025/,Official university announcement of faculty structure.,2026-03-14
Abo Akademi University,Faculty,"Faculty of Science and Engineering",,Turku,"Science; Engineering; IT",https://www.abo.fi/en/news/faculties-at-abo-akademi-university-from-january-1-2025/,Official university announcement of faculty structure.,2026-03-14
Abo Akademi University,Faculty,"Faculty of Education and Welfare Studies",,Vaasa,"Education; Welfare studies",https://www.abo.fi/en/news/faculties-at-abo-akademi-university-from-january-1-2025/,Official university announcement of faculty structure.,2026-03-14
Abo Akademi University,Department,"Department of Business and Economics","Faculty of Social Sciences, Business and Economics, and Law",Turku,"Business; Economics",https://www.abo.fi/en/about-abo-akademi-university/organisation/faculty-of-social-sciences-business-and-economics-and-law/department-of-business-and-economics/,Official department page.,2026-03-14
Abo Akademi University,Department,"Department of Law","Faculty of Social Sciences, Business and Economics, and Law",Turku,Law,https://www.abo.fi/en/news/faculties-at-abo-akademi-university-from-january-1-2025/,Department listed in official faculty announcement.,2026-03-14
Abo Akademi University,Department,"Department of Computer Science","Faculty of Science and Engineering",Turku,Computer science,https://www.abo.fi/en/subject/computer-science/,Department or subject page used as official academic unit reference.,2026-03-14
